,School Name,Full Address,Street Address,Street Number,Street,City,County,State,Zip (5-digit),Zip (full),Country,School Type,Website,Description,Latitude,Longitude,Preschool,Kindergarten,Grade 1,Grade 2,Grade 3,Grade 4,Grade 5,Grade 6,Grade 7,Grade 8,Grade 9,Grade 10,Grade 11,Grade 12,University/College
204,Indigo Christian Jr. Academy,"401 N Williamson Blvd, Daytona Beach, FL, 32114-7101, USA",401 N Williamson Blvd,401,N Williamson Blvd,Daytona Beach,Volusia County,FL,32114,32114-7101,USA,PK-08,https://www.adventisteducation.org/schools/ANTB22,,29.193201,-81.082839,True,True,True,True,True,True,True,True,True,True,False,False,False,False,False
205,James E Sampson Memorial SDA School,"3201 Memory Ln, Fort Pierce, FL, 34981-4401, USA",3201 Memory Ln,3201,Memory Ln,Fort Pierce,St. Lucie County,FL,34981,34981-4401,USA,PK-08,https://www.adventisteducation.org/schools/ANTB60,,27.406667,-80.373355,True,True,True,True,True,True,True,True,True,True,False,False,False,False,False
206,Kids Ark Development Center,"1226 Bunnell Rd, Altamonte Springs, FL, 32714-5407, USA",1226 Bunnell Rd,1226,Bunnell Rd,Altamonte Springs,Seminole County,FL,32714,32714-5407,USA,ECP,https://www.adventisteducation.org/schools/ANTBKA,,28.652364,-81.432243,True,False,False,False,False,False,False,False,False,False,False,False,False,False,False
207,Lauderhill Community Child Care Center,"1173 NW 40th Ave, Lauderhill, FL, 33313-6629, USA",1173 NW 40th Ave,1173,NW 40th Ave,Lauderhill,Broward County,FL,33313,33313-6629,USA,ECP,https://www.adventisteducation.org/schools/ANTBLN,,26.139719,-80.203746,True,False,False,False,False,False,False,False,False,False,False,False,False,False,False
208,LifePoint Academy of SDA,"4298 Livingston Rd, Jacksonville, FL, 32257-7019, USA",4298 Livingston Rd,4298,Livingston Rd,Jacksonville,Duval County,FL,32257,32257-7019,USA,PK-08,https://www.adventisteducation.org/schools/ANTB57,Building Leaders of Integrity through Academic Excellence in a Christ-entered Environment,30.176497,-81.607081,True,True,True,True,True,True,True,True,True,True,False,False,False,False,False
209,Little Peek at Heaven Preschool,"400 NW 118th Ave, Plantation, FL, 33325-1826, USA",400 NW 118th Ave,400,NW 118th Ave,Plantation,Broward County,FL,33325,33325-1826,USA,ECP,https://www.adventisteducation.org/schools/ANTBL4,,26.12395,-80.30594,True,False,False,False,False,False,False,False,False,False,False,False,False,False,False
210,Living Springs SDA Academy,"23901 NW 212th Ave, High Springs, FL, 32643-8754, USA",23901 NW 212th Ave,23901,NW 212th Ave,High Springs,Alachua County,FL,32643,32643-8754,USA,PK-08,https://www.adventisteducation.org/schools/ANTB81,,29.848539,-82.597814,True,True,True,True,True,True,True,True,True,True,False,False,False,False,False
211,Maranatha Child Development Center,"18900 NW 32nd Ave, Miami Gardens, FL, 33056-3026, USA",18900 NW 32nd Ave,18900,NW 32nd Ave,Miami Gardens,Miami-Dade County,FL,33056,33056-3026,USA,ECP,https://www.adventisteducation.org/schools/ANTBD8,,25.947112,-80.255135,True,False,False,False,False,False,False,False,False,False,False,False,False,False,False
212,Meadows Academy,"5779 County Road 427, Sanford, FL, 32773-6334, USA",5779 County Road 427,5779,County Rd 427 N,Sanford,Seminole County,FL,32773,32773-6334,USA,ECP,https://www.adventisteducation.org/schools/ANTBA4,,28.7428,-81.287197,True,False,False,False,False,False,False,False,False,False,False,False,False,False,False
213,Miami Springs Adventist School,"701 Curtiss Pkwy, Miami Springs, FL, 33166-7103, USA",701 Curtiss Pkwy,701,Curtiss Pkwy,Miami Springs,Miami-Dade County,FL,33166,33166-7103,USA,PK-08,https://www.adventisteducation.org/schools/ANTB69,,25.812816,-80.288694,True,True,True,True,True,True,True,True,True,True,False,False,False,False,False
214,Miami Union Adventist Academy,"12600 NW 4th Ave, North Miami, FL, 33168-3628, USA",12600 NW 4th Ave,12600,NW 4th Ave,North Miami,Miami-Dade County,FL,33168,33168-3628,USA,PK-12,https://www.adventisteducation.org/schools/ANTTMJ,,25.890881,-80.205455,True,True,True,True,True,True,True,True,True,True,True,True,True,True,False
215,Mount Olivet SDA School,"3013 NW 11th St, Fort Lauderdale, FL, 33311-5617, USA",3013 NW 11th St,3013,NW 11th St,Fort Lauderdale,Broward County,FL,33311,33311-5617,USA,PK-08,https://www.adventisteducation.org/schools/ANTT30,,26.138286,-80.185217,True,True,True,True,True,True,True,True,True,True,False,False,False,False,False
216,Mount Sinai Child Development Center,"2610 Orange Center Blvd, Orlando, FL, 32805-3546, USA",2610 Orange Center Blvd,2610,Orange Center Blvd,Orlando,Orange County,FL,32805,32805-3546,USA,ECP,https://www.adventisteducation.org/schools/ANTTD7,,28.530574,-81.412885,True,False,False,False,False,False,False,False,False,False,False,False,False,False,False
217,Mt. Calvary Junior Academy,"3111 E Wilder Ave, Tampa, FL, 33610-6428, USA",3111 E Wilder Ave,3111,E Wilder Ave,Tampa,Hillsborough County,FL,33610,33610-6428,USA,PK-08,https://www.adventisteducation.org/schools/ANTT35,"Mt. Calvary Jr. Academy is committed to a Christ-centered education, developing minds to learn, hearts to love, and hands to serve.",27.992109,-82.424922,True,True,True,True,True,True,True,True,True,True,False,False,False,False,False
218,Mt. Calvary Pre-School,"3111 E Wilder Ave, Tampa, FL, 33610-6428, USA",3111 E Wilder Ave,3111,E Wilder Ave,Tampa,Hillsborough County,FL,33610,33610-6428,USA,ECP,https://www.adventisteducation.org/schools/ANTTD8,,27.992109,-82.424922,True,False,False,False,False,False,False,False,False,False,False,False,False,False,False
219,Naples Adventist Christian School,"2629 Horseshoe Dr S, Naples, FL, 34104-6122, USA",2629 Horseshoe Dr S,2629,Horseshoe Dr S,Naples,Collier County,FL,34104,34104-6122,USA,PK-08,https://www.adventisteducation.org/schools/ANTB75,Our mission is to provide an environment where students learn in harmony with God's Word and  achieve academic excellence.,26.162113,-81.775563,True,True,True,True,True,True,True,True,True,True,False,False,False,False,False
220,New Beginning Child Development Ctr,"2804 Edgewood Ave W, Jacksonville, FL, 32209-2317, USA",2804 Edgewood Ave W,2804,Edgewood Ave W,Jacksonville,Duval County,FL,32209,32209-2317,USA,ECP,https://www.adventisteducation.org/schools/ANTTD9,,30.376792,-81.709851,True,False,False,False,False,False,False,False,False,False,False,False,False,False,False
221,New Hope SDA Learning Center,"545 E Campus Cir, Ft Lauderdale, FL, 33312-1905, USA",545 E Campus Cir,545,E Campus Cir,Ft Lauderdale,Broward County,FL,33312,33312-1905,USA,ECP,https://www.adventisteducation.org/schools/ANTTD0,,26.114365,-80.193332,True,False,False,False,False,False,False,False,False,False,False,False,False,False,False
222,New Hope SDA School,"545 E Campus Cir, Ft Lauderdale, FL, 33312-1905, USA",545 E Campus Cir,545,E Campus Cir,Ft Lauderdale,Broward County,FL,33312,33312-1905,USA,PK-08,https://www.adventisteducation.org/schools/ANTTNH,New Hope SDA School and Learning Center is truly an extraordinary place of learning. Thanks to our Amazing staff each student is Challenged with rigorous standards in high academics and behavioral expectation equity and a solid foundation.,26.114365,-80.193332,True,True,True,True,True,True,True,True,True,True,False,False,False,False,False
223,North Tampa Christian Academy,"5585 E County Line Rd, Wesley Chapel, FL, 33544-9301, USA",5585 E County Line Rd,5585,E County Line Rd,Wesley Chapel,Hillsborough County,FL,33544,33544-9301,USA,PK-12,https://www.adventisteducation.org/schools/ANTB2C,,28.169117,-82.373268,True,True,True,True,True,True,True,True,True,True,True,True,True,True,False
224,North Tampa Christian Explorers,"5585 E County Line Rd, Wesley Chapel, FL, 33544-9301, USA",5585 E County Line Rd,5585,E County Line Rd,Wesley Chapel,Hillsborough County,FL,33544,33544-9301,USA,ECP,https://www.adventisteducation.org/schools/ANTB2N,,28.169117,-82.373268,True,False,False,False,False,False,False,False,False,False,False,False,False,False,False
225,Ocala Adventist Academy,"415 NE 41st Ave, Ocala, FL, 34470-1462, USA",415 NE 41st Ave,415,NE 41st Ave,Ocala,Marion County,FL,34470,34470-1462,USA,PK-08,https://www.adventisteducation.org/schools/ANTB84,,29.190528,-82.077412,True,True,True,True,True,True,True,True,True,True,False,False,False,False,False
226,Okeechobee Adventist Christian School,"412 NW 6th St, Okeechobee, FL, 34972-2519, USA",412 NW 6th St,412,NW 6th St,Okeechobee,Okeechobee County,FL,34972,34972-2519,USA,PK-08,https://www.adventisteducation.org/schools/ANTB87,,27.24928,-80.833951,True,True,True,True,True,True,True,True,True,True,False,False,False,False,False
227,Orlando Junior Academy,"30 E Evans St, Orlando, FL, 32804-3942, USA",30 E Evans St,30,E Evans St,Orlando,Orange County,FL,32804,32804-3942,USA,PK-08,https://www.adventisteducation.org/schools/ANTB90,,28.577384,-81.377766,True,True,True,True,True,True,True,True,True,True,False,False,False,False,False
228,Osceola Adventist Christian School,"2395 Fortune Rd, Kissimmee, FL, 34744-3989, USA",2395 Fortune Rd,2395,Fortune Rd,Kissimmee,Osceola County,FL,34744,34744-3989,USA,PK-08,https://www.adventisteducation.org/schools/ANTB93,,28.305335,-81.346927,True,True,True,True,True,True,True,True,True,True,False,False,False,False,False
229,Palm Bay SDA School,"3507 Carriage Gate Dr, West Melbourne, FL, 32904-9596, USA",3507 Carriage Gate Dr,3507,Carriage Gate Dr,West Melbourne,Brevard County,FL,32904,32904-9596,USA,PK-08,https://www.adventisteducation.org/schools/ANTTPB,The Palm Bay S.D.A. school exists to prepare students to emulate the culture of Christ in all areas of their lives,28.046208,-80.672313,True,True,True,True,True,True,True,True,True,True,False,False,False,False,False
230,Palm Beach Bilingual Daycare,"2850 Avenue F, Riviera Beach, FL, 33404-3700, USA",2850 Avenue F,2850,Ave F,Riviera Beach,Palm Beach County,FL,33404,33404-3700,USA,ECP,https://www.adventisteducation.org/schools/ANTT2E,,26.785812,-80.057622,True,False,False,False,False,False,False,False,False,False,False,False,False,False,False
231,Pensacola Junior Academy,"8751 University Pkwy, Pensacola, FL, 32514-4910, USA",8751 University Pkwy,8751,University Pkwy,Pensacola,Escambia County,FL,32514,32514-4910,USA,PK-08,https://www.adventisteducation.org/schools/ANTG76,,30.52252,-87.22256,True,True,True,True,True,True,True,True,True,True,False,False,False,False,False
232,Perrine Child Development Center,"9850 E Datura St, Miami, FL, 33157, USA",9850 E Datura St,9850,E Datura St,Miami,Miami-Dade County,FL,33157,33157,USA,ECP,https://www.adventisteducation.org/schools/ANTTE1,,25.607352,-80.349644,True,False,False,False,False,False,False,False,False,False,False,False,False,False,False
233,Perrine Seventh-day Adventist School,"9750 E Datura St, Miami, FL, 33157, USA",9750 E Datura St,9750,E Datura St,Miami,Miami-Dade County,FL,33157,33157,USA,PK-08,https://www.adventisteducation.org/schools/ANTTPF,,25.607147,-80.349111,True,True,True,True,True,True,True,True,True,True,False,False,False,False,False
234,Port Charlotte Adventist School,"2100 Loveland Blvd, Port Charlotte, FL, 33980-5753, USA",2100 Loveland Blvd,2100,Loveland Blvd,Port Charlotte,Charlotte County,FL,33980,33980-5753,USA,PK-10,https://www.adventisteducation.org/schools/ANTBA3,,27.001642,-82.056995,True,True,True,True,True,True,True,True,True,True,True,True,False,False,False
235,Sawgrass Adventist School,"11701 NW 4th St, Plantation, FL, 33325-2511, USA",11701 NW 4th St,11701,NW 4th St,Plantation,Broward County,FL,33325,33325-2511,USA,PK-08,https://www.adventisteducation.org/schools/ANTBA9,,26.124106,-80.305713,True,True,True,True,True,True,True,True,True,True,False,False,False,False,False
236,Shiloh SDA School,"500 SW 17th Ave, Ocala, FL, 34471-1421, USA",500 SW 17th Ave,500,SW 17th Ave,Ocala,Marion County,FL,34471,34471-1421,USA,PK-08,https://www.adventisteducation.org/schools/ANTT40,We are a Seventh-day Adventist school.  Our staff is committed to providing quality education in a Christ-filled environment.,29.182906,-82.155114,True,True,True,True,True,True,True,True,True,True,False,False,False,False,False
237,Tallahassee Adventist Christian Academy,"616 Capital Cir NE, Tallahassee, FL, 32301, USA",616 Capital Cir NE,616,Capital Cir NE,Tallahassee,Leon County,FL,32301,32301,USA,PK-08,https://www.adventisteducation.org/schools/ANTBB7,,30.443322,-84.227904,True,True,True,True,True,True,True,True,True,True,False,False,False,False,False
238,Walker Memorial Academy,"1525 W Avon Blvd, Avon Park, FL, 33825-9512, USA",1525 W Avon Blvd,1525,W Avon Blvd,Avon Park,Highlands County,FL,33825,33825-9512,USA,PK-10,https://www.adventisteducation.org/schools/ANTBD3,,27.627821,-81.523756,True,True,True,True,True,True,True,True,True,True,True,True,False,False,False
239,West Coast Christian Academy,"1112 49th Ave E, Bradenton, FL, 34203-2648, USA",1112 49th Ave E,1112,49th Ave E,Bradenton,Manatee County,FL,34203,34203-2648,USA,PK-08,https://www.adventisteducation.org/schools/ANTBD7,,27.454571,-82.551237,True,True,True,True,True,True,True,True,True,True,False,False,False,False,False
240,West Palm Beach Junior Academy,"6300 Summit Blvd, West Palm Beach, FL, 33415-3551, USA",6300 Summit Blvd,6300,Summit Blvd,West Palm Beach,Palm Beach County,FL,33415,33415-3551,USA,PK-08,https://www.adventisteducation.org/schools/ANTBD9,,26.662622,-80.141838,True,True,True,True,True,True,True,True,True,True,False,False,False,False,False
241,William A Kirlew Jr Academy,"18900 NW 32nd Ave, Miami Gardens, FL, 33056-3026, USA",18900 NW 32nd Ave,18900,NW 32nd Ave,Miami Gardens,Miami-Dade County,FL,33056,33056-3026,USA,PK-08,https://www.adventisteducation.org/schools/ANTBMA,,25.947112,-80.255135,True,True,True,True,True,True,True,True,True,True,False,False,False,False,False
242,Winter Haven Adventist Academy,"401 Avenue K SE, Winter Haven, FL, 33880-4126, USA",401 Avenue K SE,401,Ave K SE,Winter Haven,Polk County,FL,33880,33880-4126,USA,PK-08,https://www.adventisteducation.org/schools/ANTBE7,,28.01156,-81.722209,True,True,True,True,True,True,True,True,True,True,False,False,False,False,False
243,Adventist Christian School,"4301 Wheeler Rd, Martinez, GA, 30907-8755, USA",4301 Wheeler Rd,4301,Wheeler Rd,Martinez,Columbia County,GA,30907,30907-8755,USA,PK-08,https://www.adventisteducation.org/schools/ANTF30,,33.48797,-82.124333,True,True,True,True,True,True,True,True,True,True,False,False,False,False,False
244,Atlanta Adventist Academy,"2959 Duluth Highway 120 # 120, Duluth, GA, 30096-3701, USA",2959 Duluth Highway 120 # 120,2959,Duluth Hwy,Duluth,Gwinnett County,GA,30096,30096-3701,USA,09-12,https://www.adventisteducation.org/schools/ANTF1B,,33.988109,-84.133152,False,False,False,False,False,False,False,False,False,False,True,True,True,True,False
245,Atlanta Adventist International School,"5241 Ash St, Forest Park, GA, 30297-3951, USA",5241 Ash St,5241,Ash St,Forest Park,Clayton County,GA,30297,30297-3951,USA,PK-08,https://www.adventisteducation.org/schools/ANTMIS,,33.611623,-84.364202,True,True,True,True,True,True,True,True,True,True,False,False,False,False,False
246,Atlanta North SDA School,"5123 Chamblee Dunwoody Rd, Atlanta, GA, 30338-4801, USA",5123 Chamblee Dunwoody Rd,5123,Chamblee Dunwoody Rd,Atlanta,Dekalb County,GA,30338,30338-4801,USA,PK-08,https://www.adventisteducation.org/schools/ANTF27,,33.938638,-84.326016,True,True,True,True,True,True,True,True,True,True,False,False,False,False,False
247,Berean Child Development Center,"401 Hamilton E Holmes Dr NW, Atlanta, GA, 30318-7303, USA",401 Hamilton E Holmes Dr NW,401,Hamilton E Holmes Dr NW,Atlanta,Fulton County,GA,30318,30318-7303,USA,ECP,https://www.adventisteducation.org/schools/ANTMBD,,33.766338,-84.469765,True,False,False,False,False,False,False,False,False,False,False,False,False,False,False
248,Berean Christian Junior Academy,"401 Hamilton E. Holmes Dr., NW, Atlanta, GA, 30318, USA","401 Hamilton E. Holmes Dr., NW",401,Hamilton E Holmes Dr NW,Atlanta,Fulton County,GA,30318,30318,USA,PK-08,https://www.adventisteducation.org/schools/ANTMAT,,33.766338,-84.469765,True,True,True,True,True,True,True,True,True,True,False,False,False,False,False
249,Bethany Christian Academy,"1550 Edna Pl, Macon, GA, 31204-4911, USA",1550 Edna Pl,1550,Edna Pl,Macon,Bibb County,GA,31204,31204-4911,USA,PK-08,https://www.adventisteducation.org/schools/ANTM32,Welcome to B.C.A.! Bethany Christian Academy (BCA) has been in the business of preparing children for the Kingdom since 1986.,32.826445,-83.689002,True,True,True,True,True,True,True,True,True,True,False,False,False,False,False
250,Carman Adventist School,"1330 Cobb Pkwy N, Marietta, GA, 30062-2422, USA",1330 Cobb Pkwy N,1330,Cobb Pkwy N,Marietta,Cobb County,GA,30062,30062-2422,USA,PK-08,https://www.adventisteducation.org/schools/ANTFB7,"Carman Adventist School provides a safe, nurturing environment where highly qualified teachers educate the whole child, in an inclusive family atmosphere.",33.984525,-84.562464,True,True,True,True,True,True,True,True,True,True,False,False,False,False,False
251,Columbus SDA School,"7880 Schomburg Rd, Columbus, GA, 31909-2000, USA",7880 Schomburg Rd,7880,Schomburg Rd,Columbus,Muscogee County,GA,31909,31909-2000,USA,PK-08,https://www.adventisteducation.org/schools/ANTF48,,32.56808,-84.909582,True,True,True,True,True,True,True,True,True,True,False,False,False,False,False
252,Conyers Adventist Academy,"3001 Old Salem Rd SE, Conyers, GA, 30013-2230, USA",3001 Old Salem Rd SE,3001,Old Salem Rd SE,Conyers,Rockdale County,GA,30013,30013-2230,USA,PK-08,https://www.adventisteducation.org/schools/ANTF2O,,33.610493,-83.993859,True,True,True,True,True,True,True,True,True,True,False,False,False,False,False
253,Decatur Adventist Junior Academy,"2584 Young Rd, Stone Mountain, GA, 30088-4204, USA",2584 Young Rd,2584,Young Rd,Stone Mountain,Dekalb County,GA,30088,30088-4204,USA,PK-08,https://www.adventisteducation.org/schools/ANTMDF,"Decatur Adventist Junior Academy is a STEAMS School which encompasses Science, Technology, Engineering, Arts, and Math with emphasis on building a spiritual relationship with God.",33.730848,-84.18155,True,True,True,True,True,True,True,True,True,True,False,False,False,False,False
254,Decatur Early Learning Center,"2584 Young Rd, Stone Mountain, GA, 30088-4204, USA",2584 Young Rd,2584,Young Rd,Stone Mountain,Dekalb County,GA,30088,30088-4204,USA,ECP,https://www.adventisteducation.org/schools/ANTMTU,,33.730848,-84.18155,True,False,False,False,False,False,False,False,False,False,False,False,False,False,False
255,Douglasville Adventist School,"2836 Bright Star Rd, Douglasville, GA, 30134-1425, USA",2836 Bright Star Rd,2836,Bright Star Rd,Douglasville,Douglas County,GA,30134,30134-1425,USA,PK-08,https://www.adventisteducation.org/schools/ANTF69,"Douglasville Adventist School, a Seventh-day Adventist Christian school, exists to show children Jesus, nurture their love for Him and others, teach them to think, and empower them to serve.",33.728586,-84.776352,True,True,True,True,True,True,True,True,True,True,False,False,False,False,False
256,Duluth Adventist Christian School,"2959 Duluth Highway 120 # 120, Duluth, GA, 30096-3701, USA",2959 Duluth Highway 120 # 120,2959,Duluth Hwy,Duluth,Gwinnett County,GA,30096,30096-3701,USA,PK-08,https://www.adventisteducation.org/schools/ANTF72,"DACS is a God-centered institution, SACS accredited Seventh-day Adventist pre-kindergarten to eighth grade school located in Duluth, GA.",33.988109,-84.133152,True,True,True,True,True,True,True,True,True,True,False,False,False,False,False
257,Ebenezer SDA School,"1699 Olive Rd, Augusta, GA, 30904-4984, USA",1699 Olive Rd,1699,Olive Rd,Augusta,Richmond County,GA,30904,30904-4984,USA,PK-08,https://www.adventisteducation.org/schools/ANTM44,,33.45319,-82.007522,True,True,True,True,True,True,True,True,True,True,False,False,False,False,False
258,Emanuel Junior Academy,"1534 E Broad Ave, Albany, GA, 31705-2259, USA",1534 E Broad Ave,1534,E Broad Ave,Albany,Dougherty County,GA,31705,31705-2259,USA,PK-08,https://www.adventisteducation.org/schools/ANTMAL,,31.575491,-84.114179,True,True,True,True,True,True,True,True,True,True,False,False,False,False,False
259,Georgia-Cumberland Academy,"397 Academy Dr SW, Calhoun, GA, 30701-7407, USA",397 Academy Dr SW,397,Academy Dr SW,Calhoun,Gordon County,GA,30701,30701-7407,USA,09-12,https://www.adventisteducation.org/schools/ANTF21,"Georgia-Cumberland Academy teaches students to know Jesus as a friend, to love God and those around us, and to serve our church and community.",34.463011,-85.019762,False,False,False,False,False,False,False,False,False,False,True,True,True,True,False
260,Greater Atlanta Adventist Academy,"401 Hamilton E Holmes Dr NW, Atlanta, GA, 30318-7303, USA",401 Hamilton E Holmes Dr NW,401,Hamilton E Holmes Dr NW,Atlanta,Fulton County,GA,30318,30318-7303,USA,09-12,https://www.adventisteducation.org/schools/ANTM2G,"Greater Atlanta Adventist Academy is a college preparatory high school that challenges students to GREATER EXPECTATIONS and ACHIEVEMENTS in their spiritual, academic, and social endeavors,",33.766338,-84.469765,False,False,False,False,False,False,False,False,False,False,True,True,True,True,False
261,John L. Coble Elementary School,"450 Academy Dr SW, Calhoun, GA, 30701-7406, USA",450 Academy Dr SW,450,Academy Dr SW,Calhoun,Gordon County,GA,30701,30701-7406,USA,PK-08,https://www.adventisteducation.org/schools/ANTF13,"We are learning, loving, and living for Jesus at John L. Coble Elementary School, an elementary school serving children in grades Pre-K to 8.",34.463661,-85.020581,True,True,True,True,True,True,True,True,True,True,False,False,False,False,False
262,Josephine Edwards Christian School,"12472 Highway 515 N, Ellijay, GA, 30536-2575, USA",12472 Highway 515 N,12472,N Hwy 515,Ellijay,Gilmer County,GA,30536,30536-2575,USA,PK-08,https://www.adventisteducation.org/schools/ANTF78,,34.711224,-84.45365,True,True,True,True,True,True,True,True,True,True,False,False,False,False,False
263,Learning Tree Elementary School,"300 S Tibbs Rd, Dalton, GA, 30720-8040, USA",300 S Tibbs Rd,300,S Tibbs Rd,Dalton,Whitfield County,GA,30720,30720-8040,USA,PK-08,https://www.adventisteducation.org/schools/ANTF60,"Above all, it is our desire that each student develops a personal relationship with Jesus Christ through studying His word and His works of creation.",34.767128,-84.994012,True,True,True,True,True,True,True,True,True,True,False,False,False,False,False
264,Lithonia Adventist Academy,"3533 Ragsdale Rd, Lithonia, GA, 30038-3421, USA",3533 Ragsdale Rd,3533,Ragsdale Rd,Lithonia,Dekalb County,GA,30038,30038-3421,USA,PK-08,https://www.adventisteducation.org/schools/ANTM64,,33.678571,-84.134432,True,True,True,True,True,True,True,True,True,True,False,False,False,False,False
265,Mt. Olive Learning Center,"3366 Mount Olive Rd, East Point, GA, 30344-5614, USA",3366 Mount Olive Rd,3366,Mt Olive Rd,East Point,Fulton County,GA,30344,30344-5614,USA,ECP,https://www.adventisteducation.org/schools/ANTM23,,33.664517,-84.477357,True,False,False,False,False,False,False,False,False,False,False,False,False,False,False
266,New Bethel Christian Academy,"2423 Woodruff Farm Rd, Columbus, GA, 31907-6855, USA",2423 Woodruff Farm Rd,2423,Woodruff Farm Rd,Columbus,Muscogee County,GA,31907,31907-6855,USA,PK-08,https://www.adventisteducation.org/schools/ANTM36,,32.483876,-84.898051,True,True,True,True,True,True,True,True,True,True,False,False,False,False,False
267,Northeast Georgia Christian Academy,"367 Church St, Cleveland, GA, 30528-1030, USA",367 Church St,367,Church St,Cleveland,White County,GA,30528,30528-1030,USA,PK-08,https://www.adventisteducation.org/schools/ANTF3C,,34.600501,-83.757479,True,True,True,True,True,True,True,True,True,True,False,False,False,False,False
268,Oglethorpe SDA School,"84 Buck Creek Bypass, Oglethorpe, GA, 31068, USA",84 Buck Creek Bypass,84,Buckcreek Byp,Oglethorpe,Macon County,GA,31068,31068,USA,PK-08,https://www.adventisteducation.org/schools/ANTFD9,,32.297416,-84.055651,True,True,True,True,True,True,True,True,True,True,False,False,False,False,False
269,Ramah Junior Academy,"3400 Florance St, Savannah, GA, 31405-1883, USA",3400 Florance St,3400,Florance St,Savannah,Chatham County,GA,31405,31405-1883,USA,PK-08,https://www.adventisteducation.org/schools/ANTM76,"Ramah Junior Academy provides a Christ-centered learning environment that promotes academic excellence, while preparing its students for citizenship in this world and the world to come.",32.049654,-81.11222,True,True,True,True,True,True,True,True,True,True,False,False,False,False,False
270,Savannah Adventist Christian Preschool,"50 Godley Way, Pooler, GA, 31322-4020, USA",50 Godley Way,50,Godley Way,Pooler,Chatham County,GA,31407,31322-4020,USA,ECP,https://www.adventisteducation.org/schools/ANTF2T,,32.153104,-81.2446,True,False,False,False,False,False,False,False,False,False,False,False,False,False,False
271,Savannah Adventist Christian School,"50 Godley Way, Pooler, GA, 31322-4020, USA",50 Godley Way,50,Godley Way,Pooler,Chatham County,GA,31407,31322-4020,USA,PK-10,https://www.adventisteducation.org/schools/ANTFG7,"Savannah Adventist Christian School, located in Pooler, Georgia, provides preschool to high school education to children and youth throughout greater Savannah.",32.153104,-81.2446,True,True,True,True,True,True,True,True,True,True,True,True,False,False,False
272,Shoal Creek Adventist School,"171 Gordon Rd, Newnan, GA, 30263-5238, USA",171 Gordon Rd,171,Gordon Rd,Newnan,Coweta County,GA,30263,30263-5238,USA,PK-08,https://www.adventisteducation.org/schools/ANTFE7,,33.3259,-84.771858,True,True,True,True,True,True,True,True,True,True,False,False,False,False,False
